{
  "schemaVersion": "1",
  "name": "rome-ui-worker",
  "kind": "bridge-worker",
  "purpose": "Settles inbound USDC / native deposits onto Rome L2 chains via per-program settle keys. Also handles outbound bridge operations (CCTP, Wormhole, native Solana).",
  "scope": "program",
  "deployment": {
    "cluster": "devnet",
    "kind": "vm",
    "location": "gcp-vm://rome-developers/europe-north1/devnet-rome-ui",
    "owner": "rome-ops"
  },
  "servesPrograms": [
    {
      "programId": "DP1dshBzmXXVsRxH5kCKMemrDuptg1JvJ1j5AsFV4Hm3",
      "since": "2026-03-13T00:00:00Z",
      "until": "2026-05-02T21:01:17Z"
    },
    {
      "programId": "5uBA85gDpaRE3Btd3SiPCsFts5H1QQJbrwwW5zmvcaSH",
      "since": "2026-04-29T22:40:05Z",
      "until": "2026-05-02T21:01:17Z"
    }
  ],
  "servesChains": [],
  "configRefs": [
    "rome-ops:ansible/inventories/devnet-rome-ui-gcp/group_vars/host_rome_ui.yml",
    "rome-ui:deploy/chains.sample.yaml"
  ],
  "secretRefs": [
    {
      "name": "settlePayers",
      "shape": "json-map",
      "keyedBy": "programId",
      "preservation": "edit-only",
      "location": "gcp:projects/rome-developers/secrets/rome-ui-settle-payers"
    }
  ],
  "lifecycle": {
    "createdAt": "2026-03-13T00:00:00Z",
    "decommissionedAt": "2026-05-02T21:01:17Z"
  },
  "audit": {
    "lastReview": null,
    "reviewUrl": null
  }
}
